{
  "$schema": "https://json-schema.org/draft/2020-12/schema",
  "$id": "https://schemas.signconnect.dev/sign-recognition/v1/inference-response.schema.json",
  "title": "SignConnect inference prediction response v1",
  "description": "Strict inference-to-realtime result correlated to one request and window. Mock metadata prevents synthetic output from being presented as validated SGSL recognition.",
  "type": "object",
  "additionalProperties": false,
  "required": [
    "schemaVersion",
    "requestId",
    "streamId",
    "windowSequence",
    "labelId",
    "captionText",
    "confidence",
    "modelVersion",
    "inferenceLatencyMs",
    "mockModel"
  ],
  "properties": {
    "schemaVersion": {
      "type": "integer",
      "const": 1,
      "description": "The v1 wire-contract version."
    },
    "requestId": {
      "$ref": "#/$defs/uuid"
    },
    "streamId": {
      "$ref": "#/$defs/uuid"
    },
    "windowSequence": {
      "type": "integer",
      "minimum": 0,
      "description": "The request window sequence echoed unchanged."
    },
    "labelId": {
      "type": "string",
      "minLength": 1,
      "maxLength": 64,
      "pattern": "^[A-Z][A-Z0-9_]*$",
      "description": "A stable ASCII classifier label identifier."
    },
    "captionText": {
      "type": [
        "string",
        "null"
      ],
      "minLength": 1,
      "maxLength": 240,
      "description": "Proposed display text for a recognized label, or null for NO_SIGN/no caption."
    },
    "confidence": {
      "type": "number",
      "minimum": 0,
      "maximum": 1,
      "description": "Finite classifier confidence in the inclusive range 0 through 1."
    },
    "modelVersion": {
      "type": "string",
      "minLength": 1,
      "maxLength": 64,
      "pattern": "^[A-Za-z0-9][A-Za-z0-9._-]*$",
      "description": "A non-sensitive model artifact version identifier."
    },
    "inferenceLatencyMs": {
      "type": "number",
      "minimum": 0,
      "description": "Finite inference latency in milliseconds; excludes network and stabilization time."
    },
    "mockModel": {
      "type": "boolean",
      "description": "True only for the deterministic synthetic integration model."
    }
  },
  "$defs": {
    "uuid": {
      "type": "string",
      "format": "uuid",
      "pattern": "^[0-9a-fA-F]{8}-[0-9a-fA-F]{4}-[0-9a-fA-F]{4}-[0-9a-fA-F]{4}-[0-9a-fA-F]{12}$",
      "description": "A UUID serialized with hyphens."
    }
  }
}
