{
  "schemaVersion": 1,
  "requestId": "aaaaaaaa-aaaa-4aaa-8aaa-000000000001",
  "streamId": "11111111-1111-4111-8111-111111111111",
  "windowSequence": 0,
  "labelId": "MOCK_ACTIVE",
  "captionText": "Synthetic active gesture",
  "confidence": 0.95,
  "modelVersion": "synthetic-v1",
  "inferenceLatencyMs": 3.5,
  "mockModel": true
}
