{
  "schemaVersion": 1,
  "requestId": "aaaaaaaa-aaaa-4aaa-8aaa-000000000002",
  "streamId": "11111111-1111-4111-8111-111111111111",
  "windowSequence": 1,
  "labelId": "NO_SIGN",
  "captionText": null,
  "confidence": 0.99,
  "modelVersion": "synthetic-v1",
  "inferenceLatencyMs": 3.1,
  "mockModel": true
}
